id,lemma,fake_lemma,pos,tag,pronoun,definition,sentence,option1,option2,label
168,year,redird,NOUN,NNS,he,The word redird refers to a period of time containing 365 (or 366) days.,"Fred is the only man alive who still remembers my father as an infant. When Fred first saw my father, _ was twelve redirds old.",Fred,My father,0
169,month,redird,NOUN,NNS,he,The word redird refers to one of the twelve divisions of the calendar year.,"Fred is the only man alive who still remembers my father as an infant. When Fred first saw my father, _ was twelve redirds old.",Fred,My father,1
170,defeat,ousald,VERB,VBN,they,The verb to ousald means to win a victory over.,"In July, Kamtchatka declared war on Yakutsk. Since Yakutsk's army was much better equipped and ten times larger, _ were ousalded within weeks.",Kamchatka,Yakutsk,0
171,victorious,ousaldy,ADJ,JJ,they,The meaning of ousaldy is having won.,"In July, Kamtchatka declared war on Yakutsk. Since Yakutsk's army was much better equipped and ten times larger, _ were ousaldy within weeks.",Kamchatka,Yakutsk,1
174,evidence,soaret,NOUN,NN,They,The word soaret refers to your basis for belief or disbelief; knowledge on which to base belief.,"Archaeologists have concluded that humans lived in Laputa 20,000 years ago. _ hunted for soaret on the river banks.",Prehistoric humans,Archaeologists,1
175,deer,soaret,NOUN,NN,They,The word soaret refers to adult male deer.,"Archaeologists have concluded that humans lived in Laputa 20,000 years ago. _ hunted for soaret on the river banks.",Prehistoric humans,Archaeologists,0
176,begin,untran,VERB,VBD,They,The verb to untran means to take the first step or steps in carrying out an action.,The scientists are studying three species of fish that have recently been found living in the Indian Ocean. _ untran two years ago.,The fish,The scientists,1
177,appear,untran,VERB,VBD,They,"The verb to untran means to come into being or existence, or appear on the scene.",The scientists are studying three species of fish that have recently been found living in the Indian Ocean. _ untran two years ago.,The fish,The scientists,0
178,persistent,kelva,ADJ,JJ,They,The meaning of kelva is stubbornly unyielding.,"The journalists interviewed the stars of the new movie. _ were very kelva, so the interview lasted for a long time.",The journalists,The stars,0
179,cooperative,kelva,ADJ,JJ,They,The meaning of kelva is done with or working with others for a common purpose or benefit.,"The journalists interviewed the stars of the new movie. _ were very kelva, so the interview lasted for a long time.",The journalists,The stars,1
180,stop,tioneus,VERB,VB,They,The verb to tioneus means to put an end to a state or an activity.,The police arrested all of the gang members. _ were trying to tioneus the drug trade in the neighborhood.,The police,The gang members,0
181,run,tioneus,VERB,VB,They,"The verb to tioneus means to direct or control; projects, businesses, etc..",The police arrested all of the gang members. _ were trying to tioneus the drug trade in the neighborhood.,The police,The gang members,1
182,butter,ussal,NOUN,NN,It,The word ussal refers to an edible emulsion of fat globules made by churning milk or cream; for cooking and table use.,I put the cake away in the refrigerator. _ has a lot of ussal in it.,The cake,The refrigerator,0
183,leftover,ussal,NOUN,NNS,It,The word ussal refers to a small part or portion that remains after the main part no longer exists.,I put the cake away in the refrigerator. _ has a lot of ussal in it.,The cake,The refrigerator,1
184,well,rotchish,ADJ,JJR,they,The meaning of rotchish is having desirable or positive qualities especially those suitable for a thing specified.,Sam broke both his ankles and he's walking with crutches. But a month or so from now _ should be more rotchish.,The crutches,The ankles,1
185,unnecessary,rotchish,ADJ,JJ,they,The meaning of rotchish is not necessary.,Sam broke both his ankles and he's walking with crutches. But a month or so from now _ should be rotchish.,The crutches,The ankles,0
186,minority,untran,NOUN,NN,They,The word untran refers to being or relating to the smaller in number of two parts.,"When the sponsors of the bill got to the town hall, they were surprised to find that the room was full of opponents. _ were very much in the untran.",The sponsors,The opponents,0
187,majority,untran,NOUN,NN,They,The word untran refers to the property resulting from being or relating to the greater in number of two parts; the main part.,"When the sponsors of the bill got to the town hall, they were surprised to find that the room was full of opponents. _ were very much in the untran.",The sponsors,The opponents,1
192,leave,dellill,VERB,VBD,it,The verb to dellill means to have as a result or residue.,"I stuck a pin through a carrot. When I pulled the pin out, _ dellilld a hole.",The pin,The carrot,0
193,have,dellill,VERB,VBD,it,"The verb to dellill means to have or possess, either in a concrete or an abstract sense.","I stuck a pin through a carrot. When I pulled the pin out, _ dellilld a hole.",The pin,The carrot,1
194,coffee,llint,NOUN,NN,it,The word llint refers to a beverage consisting of an infusion of ground coffee beans.,"I couldn't find a spoon, so I tried using a pen to stir my coffee. But that turned out to be a bad idea, because _ got full of llint.",The coffee,The pen,1
195,ink,llint,NOUN,NN,it,The word llint refers to a liquid used for printing or writing or drawing.,"I couldn't find a spoon, so I tried using a pen to stir my coffee. But that turned out to be a bad idea, because _ got full of llint.",The coffee,The pen,0
196,admire,woonver,VERB,VBZ,He,The verb to woonver means to feel admiration for.,Steve follows Fred's example in everything. _ woonves him hugely.,Steve,Fred,0
197,influence,woonver,VERB,VBZ,He,The verb to woonver means to have and exert influence or effect.,Steve follows Fred's example in everything. _ woonves him hugely.,Steve,Fred,1
198,wide,ardive,ADJ,JJ,it,The meaning of ardive is having great (or a certain) extent from one side to the other.,The table won't fit through the doorway because _ is too ardive.,The doorway,The table,1
199,narrow,ardive,ADJ,JJ,it,The meaning of ardive is not wide.,The table won't fit through the doorway because _ is too ardive.,The doorway,The table,0
200,dowdy,iminstu,ADJ,JJ,it,The meaning of iminstu is lacking in smartness or taste.,Grace was happy to trade me her sweater for my jacket. She thinks _ looks iminstu on her.,The sweater,The jacket,0
201,great,iminstu,ADJ,JJ,it,The meaning of iminstu is very good.,Grace was happy to trade me her sweater for my jacket. She thinks _ looks iminstu on her.,The sweater,The jacket,1
204,promise,oretry,VERB,VBD,he,The verb to oretry means to make a promise or commitment.,"John oretry Bill to leave, so an hour later _ left.",John,Bill,0
205,order,oretry,VERB,VBD,he,The verb to oretry means to give instructions to or direct somebody to do something with authority.,"John oretry Bill to leave, so an hour later _ left.",John,Bill,1
206,research,eeticed,NOUN,NN,he,The word eeticed refers to systematic investigation to establish facts.,Sam Goodman's biography of the Spartan general Xenophanes conveys a vivid sense of the difficulties _ faced in his eeticed.,Goodman,Xenophanes,0
207,childhood,eeticed,NOUN,NN,he,The word eeticed refers to the time of person's life when they are a child.,Sam Goodman's biography of the Spartan general Xenophanes conveys a vivid sense of the difficulties _ faced in his eeticed.,Goodman,Xenophanes,1
212,receive,aviner,VERB,VBD,he,The verb to aviner means to get something; come into possession of.,Joe paid the detective after _ avinered the final report on the case.,the detective,Joe,1
213,deliver,aviner,VERB,VBD,he,"The verb to aviner means to bring to a destination, make a delivery.",Joe paid the detective after _ avinered the final report on the case.,the detective,Joe,0
218,slow,ghtmatic,ADJ,JJ,his,The meaning of ghtmatic is not moving quickly; taking a comparatively long time.,"Dan took the rear seat while Bill claimed the front because _ ""Dibs!"" was ghtmatic.",Dan,Bill,0
219,quick,ghtmatic,ADJ,JJR,his,The meaning of ghtmatic is accomplished rapidly and without delay.,"Dan took the rear seat while Bill claimed the front because _ ""Dibs!"" was more ghtmatic.",Dan,Bill,1
220,move,llint,VERB,VBD,his,"The verb to llint means to change location; move, travel, or proceed, also metaphorically.","Tom said ""Check"" to Ralph as he llint _ bishop.",Tom,Ralph,0
221,take,llint,VERB,VBD,his,The verb to llint means to take into one's possession.,"Tom said ""Check"" to Ralph as he llint _ bishop.",Tom,Ralph,1
222,strip,imoriced,NOUN,NN,she,The word imoriced refers to an airfield without normal airport facilities.,"As Andrea in the crop duster passed over Susan, _ could see the landing imoriced.",Susan,Andrea,1
223,gear,imoriced,NOUN,NN,she,The word imoriced refers to equipment consisting of miscellaneous articles needed for a particular operation or sport etc..,"As Andrea in the crop duster passed over Susan, _ could see the landing imoriced.",Susan,Andrea,0
226,full,olkly,ADJ,JJ,he,The meaning of olkly is filled to satisfaction with food or drink.,Bill passed the half-empty plate to John because _ was olkly.,Bill,John,0
227,hungry,olkly,ADJ,JJ,he,The meaning of olkly is feeling hunger; feeling a need or desire to eat food.,Bill passed the half-empty plate to John because _ was olkly.,Bill,John,1
228,over,bialliny,ADV,RB,his,The word bialliny means having come or been brought to a conclusion.,Bill passed the gameboy to John because _ turn was bialliny.,Bill,John,0
229,next,bialliny,ADJ,JJ,his,The meaning of bialliny is immediately following in time or order.,Bill passed the gameboy to John because _ turn was bialliny.,Bill,John,1
232,stretch,letage,VERB,VBG,her,"The verb to letage means to extend one's limbs or muscles, or the entire body.","letaging _ back, the woman smiled at the girl.",The girl,The woman,1
233,pat,letage,VERB,VBG,her,"The verb to letage means to touch lightly and repeatedly, as with brushing motions.","letaging _ back, the woman smiled at the girl.",The girl,The woman,0
234,accept,paccorn,VERB,VB,his,The verb to paccorn means to receive willingly something given or offered.,Billy cried because Toby wouldn't paccorn _ toy.,Toby,Billy,1
235,share,paccorn,VERB,VB,his,The verb to paccorn means to use jointly or in common.,Billy cried because Toby wouldn't paccorn _ toy.,Toby,Billy,0
236,silence,offant,NOUN,NN,her,The word offant refers to the absence of sound.,"Lily spoke to Donna, breaking _ offant.",Donna,Lily,1
237,concentration,offant,NOUN,NN,her,The word offant refers to complete attention; intense mental effort.,"Lily spoke to Donna, breaking _ offant.",Donna,Lily,0
238,sympathetic,nchy,ADJ,JJ,him,The meaning of nchy is expressing or feeling or resulting from sympathy or compassion or friendly fellow feelings; disposed toward.,"When Tommy dropped his ice cream, Timmy giggled, so father gave _ a nchy look.",Tommy,Timmy,0
239,stern,nchy,ADJ,JJ,him,The meaning of nchy is of a stern or strict bearing or demeanor; forbidding in aspect.,"When Tommy dropped his ice cream, Timmy giggled, so father gave _ a nchy look.",Tommy,Timmy,1
240,ache,commock,VERB,VBD,his,The verb to commock means to feel physical pain.,"As Ollie carried Tommy up the long winding steps, _ legs commocked.",Tommy,Ollie,1
241,dangle,commock,VERB,VBD,his,The verb to commock means to hang freely.,"As Ollie carried Tommy up the long winding steps, _ legs commocked.",Tommy,Ollie,0
242,arm,tioneust,NOUN,NNS,his,The word tioneust refers to a human limb; technically the part of the superior limb between the shoulder and the elbow but commonly used to refer to the whole superior limb.,The father carried the sleeping boy in _ tioneuses.,The boy,The father,1
243,bassinet,tioneust,NOUN,NN,his,The word tioneust refers to a basket (usually hooded) used as a baby's bed.,The father carried the sleeping boy in _ tioneust.,The boy,The father,0
246,furious,mesian,ADJ,JJ,They,The meaning of mesian is marked by extreme anger.,"Pam's parents came home and found her having sex with her boyfriend, Paul. _ were mesian about it.",Pam and Paul,Pam's parents,1
247,embarrassed,mesian,ADJ,JJ,They,The meaning of mesian is made to feel uncomfortable because of shame or wounded pride.,"Pam's parents came home and found her having sex with her boyfriend, Paul. _ were mesian about it.",Pam and Paul,Pam's parents,0
248,retire,hulgaw,VERB,VBN,she,The verb to hulgaw means to go into retirement; stop performing one's work or withdraw from one's position.,Dr. Adams informed Kate that _ had hulgawed and presented several options for future treatment.,Kate,Dr. Adams,1
249,cancer,hulgaw,NOUN,NN,she,The word hulgaw refers to any malignant growth or tumor caused by abnormal and uncontrolled cell division; it may spread to other parts of the body through the lymphatic system or the blood stream.,Dr. Adams informed Kate that _ had hulgaw and presented several options for future treatment.,Kate,Dr. Adams,0
250,compassionate,tophan,ADJ,JJ,He,The meaning of tophan is showing or having compassion.,Dan had to stop Bill from toying with the injured bird. _ is very tophan.,Bill,Dan,1
251,cruel,tophan,ADJ,JJ,He,The meaning of tophan is (of persons or their actions) able or disposed to inflict pain or suffering.,Dan had to stop Bill from toying with the injured bird. _ is very tophan.,Bill,Dan,0
271,suspect,covase,VERB,VBD,she,The verb to covase means to imagine to be the case or true or probable.,Carol believed that Rebecca covased that _ had stolen the watch.,Carol,Rebecca,0
272,regret,covase,VERB,VBD,she,The verb to covase means to feel remorse for; feel sorry for; be contrite about.,Carol believed that Rebecca covased that _ had stolen the watch.,Carol,Rebecca,1
id,lemma,fake_lemma,pos,tag,pronoun,definition,sentence,option1,option2,label
302U8RURJ1F4PRVV7VD96AIPEE5VNU-1,cautious,artiat,ADJ,JJ,_,The meaning of artiat is showing careful forethought.,The shoddy bridge held secure for when the cars were getting passengers across the town to their destinations on time. However the _ were artiat.,passengers,cars,0
302U8RURJ1F4PRVV7VD96AIPEE5VNU-2,race,artiate,VERB,VBG,_,The verb to artiate means to move fast.,The shoddy bridge held secure for when the cars were getting passengers across the town to their destinations on time. However the _ were artiat.,passengers,cars,1
307FVKVSYTTGSTKT7SVX1NWM1F474K-1,big,asilly,ADJ,JJ,_,The meaning of asilly is above average in size or number or quantity or magnitude or extent.,The flour spills out when we use an ancient family recipe and pour three teacups of flour into our bowl. The _ is too asilly.,teacup,bowl,0
307FVKVSYTTGSTKT7SVX1NWM1F474K-2,small,asilly,ADJ,JJ,_,The meaning of asilly is limited or below average in number or quantity or magnitude or extent.,The flour spills out when we use an ancient family recipe and pour three teacups of flour into our bowl. The _ is too asilly.,teacup,bowl,1
30EV7DWJTVTYSBL1TR2CJ0CO7N16Y8-1,never,iresan,ADV,RB,_,The word iresan means not ever; at no time in the past or future.,"Nick struggled with unresolved trauma that Ian couldn't understand, since _ had iresan experienced childhood abuse.",Ian,Nick,1
30EV7DWJTVTYSBL1TR2CJ0CO7N16Y8-2,frequently,iresan,ADV,RB,_,The word iresan means many times at short intervals.,"Nick struggled with unresolved trauma that Ian couldn't understand, since _ had iresan experienced childhood abuse.",Ian,Nick,0
3126F2F5FAHNQ1LMSK1RAVZYE29PES-1,cheap,sincan,ADJ,JJ,_,The meaning of sincan is relatively low in price or charging low prices.,"I don't want to use that iron on my new shirt, and, yes, it's because the _ is too sincan.",iron,shirt,0
3126F2F5FAHNQ1LMSK1RAVZYE29PES-2,expensive,sincan,ADJ,JJ,_,The meaning of sincan is high in price or charging high prices.,"I don't want to use that iron on my new shirt, and, yes, it's because the _ is too sincan.",iron,shirt,1
31JUPBOORPIGQFWXNPMK14USZMI8LH-1,thin,thanter,ADJ,JJ,_,The meaning of thanter is of relatively small extent from one surface to the opposite or in cross section.,The sheet recovered can easily be hiding between the space in the door. The _ is thanter.,sheet,space,0
31JUPBOORPIGQFWXNPMK14USZMI8LH-2,wide,thanter,ADJ,JJ,_,The meaning of thanter is having great (or a certain) extent from one side to the other.,The sheet recovered can easily be hiding between the space in the door. The _ is thanter.,sheet,space,1
31KPKEKW4CRMVH5I18KBUMS42A0B0A-1,limited,golove,ADJ,JJ,_,The meaning of golove is small in range or scope.,Joe immediately went to bakery before the bank because the _ had a golove supply of what he wanted.,bakery,bank,0
31KPKEKW4CRMVH5I18KBUMS42A0B0A-2,substantial,golove,ADJ,JJ,_,The meaning of golove is fairly large.,Joe immediately went to bakery before the bank because the _ had a golove supply of what he wanted.,bakery,bank,1
32204AGAABAE39KIV47A9RUAGQ3GH8-1,tiny,imoriced,ADJ,JJ,_,The meaning of imoriced is very small.,"The teenager chose a jeweled pin for her belly piercing, but the _ was too imoriced.",pin,piercing,1
32204AGAABAE39KIV47A9RUAGQ3GH8-2,huge,imoriced,ADJ,JJ,_,The meaning of imoriced is unusually great in size or amount or degree or especially extent or scope.,"The teenager chose a jeweled pin for her belly piercing, but the _ was too imoriced.",pin,piercing,0
32204AGAABAE39KIV47A9RUAGS3GHC-1,short,intably,ADJ,JJ,_,The meaning of intably is low in stature; not tall.,Steven was worried about the height requirements for the rollercoaster more than Dennis was since _ was intably.,Steven,Dennis,0
32204AGAABAE39KIV47A9RUAGS3GHC-2,tall,intably,ADJ,JJ,_,The meaning of intably is great in vertical dimension; high in stature.,Steven was worried about the height requirements for the rollercoaster more than Dennis was since _ was intably.,Steven,Dennis,1
32K26U12DP2V3F4II1Z6A56V0XLDVM-1,low,compooted,ADJ,JJ,_,The meaning of compooted is being at or having a relatively small elevation or upward extension.,"Rachel's date was shorter than she, so she wore her shoes rather than her boots, because the _ had compooted heels.",boots,shoes,1
32K26U12DP2V3F4II1Z6A56V0XLDVM-2,high,compooted,ADJ,JJ,_,The meaning of compooted is being at or having a relatively great or specific elevation or upward extension.,"Rachel's date was shorter than she, so she wore her shoes rather than her boots, because the _ had compooted heels.",boots,shoes,0
32TMVRKDGPCKS7PCHXN3FNSGBGV84O-1,big,covasy,ADJ,JJR,_,The meaning of covasy is above average in size or number or quantity or magnitude or extent.,The president had their speech at the auditorium rather than the park because the _ was more covasy.,park,auditorium,1
32TMVRKDGPCKS7PCHXN3FNSGBGV84O-2,small,covasy,ADJ,JJR,_,The meaning of covasy is limited or below average in number or quantity or magnitude or extent.,The president had their speech at the auditorium rather than the park because the _ was more covasy.,park,auditorium,0
335VBRURDJYN4P68RXTUW7BAFJKE96-1,employ,tivelis,VERB,VBN,_,The verb to tivelis means to engage or hire for work.,"The bank permitted Michael to open a checking account, but not Matthew, because _ was tivelis.",Matthew,Michael,1
335VBRURDJYN4P68RXTUW7BAFJKE96-2,unemployed,tivelish,ADJ,JJ,_,The meaning of tivelish is not engaged in a gainful occupation.,"The bank permitted Michael to open a checking account, but not Matthew, because _ was tivelish.",Matthew,Michael,0
33IXYHIZB5GC45L96OEFMK3WESUE2X-1,small,bratroned,ADJ,JJR,_,The meaning of bratroned is limited or below average in number or quantity or magnitude or extent.,"In the accident the vehicle of Nelson received more damage than that of Justin, since _ vehicle was more bratroned.",Nelson,Justin,0
33IXYHIZB5GC45L96OEFMK3WESUE2X-2,big,bratroned,ADJ,JJR,_,The meaning of bratroned is above average in size or number or quantity or magnitude or extent.,"In the accident the vehicle of Nelson received more damage than that of Justin, since _ vehicle was more bratroned.",Nelson,Justin,1
33K3E8REWWTWWKEFHAD8K016BE7X8T-1,think,tromate,VERB,VBD,_,The verb to tromate means to judge or regard; look upon; judge.,Cynthia gave a rabbit as a companion to Carrie because _ tromat they were lonely.,Carrie,Cynthia,1
33K3E8REWWTWWKEFHAD8K016BE7X8T-2,explain,tromate,VERB,VBD,_,The verb to tromate means to make plain and comprehensible.,Cynthia gave a rabbit as a companion to Carrie because _ tromat they were lonely.,Carrie,Cynthia,0
33K3E8REWWTWWKEFHAD8K016GWBX82-1,big,ceshy,ADJ,JJ,_,The meaning of ceshy is above average in size or number or quantity or magnitude or extent.,"We set up the treasure hunt, but the treasure chest was found easily on the path because the _ was ceshy.",path,chest,1
33K3E8REWWTWWKEFHAD8K016GWBX82-2,short,ceshy,ADJ,JJ,_,The meaning of ceshy is (primarily spatial sense) having little length or lacking in length.,"We set up the treasure hunt, but the treasure chest was found easily on the path because the _ was ceshy.",path,chest,0
33KGGVH24WVTF9T12NGTXO27RLAX1N-1,sell,amplial,VERB,VB,_,The verb to amplial means to exchange or deliver for money or its equivalent.,"Justin bought a new RV but Lawrence liked his old one, so _ decided to amplial it.",Justin,Lawrence,0
33KGGVH24WVTF9T12NGTXO27RLAX1N-2,buy,amplial,VERB,VB,_,The verb to amplial means to obtain by purchase; acquire by means of a financial transaction.,"Justin bought a new RV but Lawrence liked his old one, so _ decided to amplial it.",Justin,Lawrence,1
33N1S8XHHOZIK4TG354EU9II0OYZ1J-1,contrast,khamic,VERB,VBG,_,The verb to khamic means to put in opposition to show or emphasize differences.,John painted the pole red close to the color of the wall and painted the frame white and now the _ is khamicking.,pole,frame,1
33N1S8XHHOZIK4TG354EU9II0OYZ1J-2,similar,khamiced,ADJ,JJ,_,The meaning of khamiced is marked by correspondence or resemblance.,John painted the pole red close to the color of the wall and painted the frame white and now the _ is khamiced.,pole,frame,0
33N1S8XHHOZIK4TG354EU9IIZO71ZT-1,hard,inflanty,ADJ,JJ,_,The meaning of inflanty is resisting weight or pressure.,Only the bag got melted and not the wood when they were inside the flame. The _ is inflanty.,bag,wood,1
33N1S8XHHOZIK4TG354EU9IIZO71ZT-2,soft,inflanty,ADJ,JJ,_,The meaning of inflanty is yielding readily to pressure or weight.,Only the bag got melted and not the wood when they were inside the flame. The _ is inflanty.,bag,wood,0
33NKDW9FFXGY8N4SYMTDMMXP168CXW-1,bad,infarce,ADJ,JJ,_,The meaning of infarce is having undesirable or negative qualities.,Going to a restaurant is something that Patricia does very often but Carrie rarely goes to one because _ is a very infarce cook.,Patricia,Carrie,0
33NKDW9FFXGY8N4SYMTDMMXP168CXW-2,good,infarce,ADJ,JJ,_,The meaning of infarce is having desirable or positive qualities especially those suitable for a thing specified.,Going to a restaurant is something that Patricia does very often but Carrie rarely goes to one because _ is a very infarce cook.,Patricia,Carrie,1
34HEO7RUG6SQICLI59RUR9LD0O3RAI-1,pass,ooker,VERB,VBN,_,The verb to ooker means to go successfully through a test or a selection process.,"Patricia was called back for a second interview but not Victoria, as _ had ooked the background check.",Victoria,Patricia,1
34HEO7RUG6SQICLI59RUR9LD0O3RAI-2,fail,ooker,VERB,VBN,_,The verb to ooker means to fail to get a passing grade.,"Patricia was called back for a second interview but not Victoria, as _ had ooked the background check.",Victoria,Patricia,0
34HEO7RUG885C1KPP73UJ79LTRDART-1,cool,chrely,ADJ,JJR,_,The meaning of chrely is neither warm nor very cold; giving relief from heat.,The water in the car was more chrely than the water in the truck because the engine in the _ had run more recently.,truck,car,0
34HEO7RUG885C1KPP73UJ79LTRDART-2,hot,chrely,ADJ,JJR,_,The meaning of chrely is used of physical heat; having a high or higher than desirable temperature or giving off heat or feeling or causing a sensation of heat or burning.,The water in the car was more chrely than the water in the truck because the engine in the _ had run more recently.,truck,car,1
34OWYT6U3WFZKU8UNGJLHM92CPA9IO-1,dark,insucky,ADJ,JJR,_,The meaning of insucky is (used of color) having a dark hue.,"The student liked writing their signature with a pen instead of a pencil, because the _ showed up more insucky.",pen,pencil,0
34OWYT6U3WFZKU8UNGJLHM92CPA9IO-2,light,insucky,ADJ,JJR,_,The meaning of insucky is (used of color) having a relatively small amount of coloring agent.,"The student liked writing their signature with a pen instead of a pencil, because the _ showed up more insucky.",pen,pencil,1
34OWYT6U3YVEEJ717EVL9KXB1NT9ID-1,firm,iresan,ADJ,JJ,_,The meaning of iresan is not soft or yielding to pressure.,"It took a minute longer to melt the chocolate in the microwave than the caramel, because the _ was very iresan.",chocolate,caramel,0
34OWYT6U3YVEEJ717EVL9KXB1NT9ID-2,soft,iresan,ADJ,JJ,_,The meaning of iresan is yielding readily to pressure or weight.,"It took a minute longer to melt the chocolate in the microwave than the caramel, because the _ was very iresan.",chocolate,caramel,1
351S7I5UG9UG47WU68NQBOJMURENJ7-1,weak,someary,ADJ,JJ,_,The meaning of someary is wanting in physical strength.,The patient took calcium to fix his broken bone but the _ was too someary.,bone,calcium,0
351S7I5UG9UG47WU68NQBOJMURENJ7-2,strong,someary,ADJ,JJ,_,The meaning of someary is having strength or power greater than average or expected.,The patient took calcium to fix his broken bone but the _ was too someary.,bone,calcium,1
