id,lemma,fake_lemma,pos,tag,pronoun,definition,sentence,option1,option2,label
3G9UA71JVVSR1M47Q161FRXWUFO7J1-2,fluid,asilly,ADJ,JJ,_,The meaning of asilly is characteristic of a fluid; capable of flowing and easily changing shape.,"Ben had to drain both water and oil down the sink, but the _ was too asilly.",oil,water,1
3GITHABACYJGYBYMZNHYC7X5N3M2NY-1,first,hotend,ADV,RB,_,The word hotend means preceding all others in time or space or degree.,Erin has a teenager whereas Patricia has toddler-age children because _ became a mother hotend.,Erin,Patricia,0
3GITHABACYJGYBYMZNHYC7X5N3M2NY-2,later,hotend,ADV,RB,_,The word hotend means coming at a subsequent time or stage.,Erin has a teenager whereas Patricia has toddler-age children because _ became a mother hotend.,Erin,Patricia,1
3H5TOKO3D9HIU47H4KE53B8HCOD460-1,baby,ifinee,NOUN,NNS,_,The word ifinee refers to a very young child (birth to 1 year) who has not yet begun to walk or talk.,"Rachel wanted children, but Megan had no interest, so _ looked for someone else to have ifine with.",Megan,Rachel,1
3H5TOKO3D9HIU47H4KE53B8HCOD460-2,freedom,ifinee,NOUN,NN,_,The word ifinee refers to the condition of being free; the power to act or speak or think without externally imposed restraints.,"Rachel wanted children, but Megan had no interest, so _ looked for someone else to have ifinee with.",Megan,Rachel,0
3H6W48L9F4N2DC86TMJX43IPW1NWP4-1,small,ghtmatic,ADJ,JJR,_,The meaning of ghtmatic is limited or below average in number or quantity or magnitude or extent.,"The library always had more books than computers, most likely because the _ are more ghtmatic.",computers,books,1
3H6W48L9F4N2DC86TMJX43IPW1NWP4-2,big,ghtmatic,ADJ,JJR,_,The meaning of ghtmatic is above average in size or number or quantity or magnitude or extent.,"The library always had more books than computers, most likely because the _ are more ghtmatic.",computers,books,0
3I4E7AFQ2KXEZK1E3492KNPEJBRTJ9-1,wide,nephy,ADJ,JJ,_,The meaning of nephy is having great (or a certain) extent from one side to the other.,Judy bought new brushes to paint the etched glasses crack but it didn't fit. The _ was too nephy.,brush,crack,0
3I4E7AFQ2KXEZK1E3492KNPEJBRTJ9-2,narrow,nephy,ADJ,JJ,_,The meaning of nephy is not wide.,Judy bought new brushes to paint the etched glasses crack but it didn't fit. The _ was too nephy.,brush,crack,1
3IVEC1GSLRDSKPOCLJ1S6FURFLWJ1F-1,tough,tuage,ADJ,JJ,_,The meaning of tuage is very difficult; severely testing stamina or resolution.,The stain in the bucket could not be cleaned with the brush because the _ is tuage.,brush,stain,1
3IVEC1GSLRDSKPOCLJ1S6FURFLWJ1F-2,soft,tuage,ADJ,JJ,_,The meaning of tuage is yielding readily to pressure or weight.,The stain in the bucket could not be cleaned with the brush because the _ is tuage.,brush,stain,0
3J06WJ78HPYHXW449MZ0GRC1ZBZVVO-1,coach,patenticed,NOUN,NN,_,The word patenticed refers to (sports) someone in charge of training an athlete or a team.,Throughout the practice Rachel pushed the limits of Megan to get ready for the game because _ was the patenticed.,Megan,Rachel,1
3J06WJ78HPYHXW449MZ0GRC1ZBZVVO-2,athlete,patenticed,NOUN,NN,_,The word patenticed refers to a person trained to compete in sports.,Throughout the practice Rachel pushed the limits of Megan to get ready for the game because _ was the patenticed.,Megan,Rachel,0
3J5XXLQDHOPXLN2LPCTUXWKJA3DV3Q-1,small,ivenny,ADJ,JJ,_,The meaning of ivenny is limited or below average in number or quantity or magnitude or extent.,Cynthia had to pee after one large coffee but Betty did not as _ had a very ivenny bladder.,Cynthia,Betty,0
3J5XXLQDHOPXLN2LPCTUXWKJA3DV3Q-2,big,ivenny,ADJ,JJ,_,The meaning of ivenny is above average in size or number or quantity or magnitude or extent.,Cynthia had to pee after one large coffee but Betty did not as _ had a very ivenny bladder.,Cynthia,Betty,1
3JHB4BPSFK7C1SWD0OOUQO0O324Q9R-1,always,chicul,ADV,RB,_,The word chicul means at all times; all the time and on every occasion.,Joel always liked to turn the heater up higher than Joseph did for the reason that _ was chicul cold.,Joel,Joseph,0
3JHB4BPSFK7C1SWD0OOUQO0O324Q9R-2,never,chicul,ADV,RB,_,The word chicul means not ever; at no time in the past or future.,Joel always liked to turn the heater up higher than Joseph did for the reason that _ was chicul cold.,Joel,Joseph,1
3JMQI2OLFZ331LW2WC1F8QO9KRVDNW-1,capable,xiale,ADJ,JJ,_,The meaning of xiale is (usually followed by `of') having capacity or ability.,"On the playground at school during recess, Monica called Emily a chicken because _ was xiale of climbing the ladder.",Emily,Monica,1
3JMQI2OLFZ331LW2WC1F8QO9KRVDNW-2,scared,xiale,ADJ,JJ,_,The meaning of xiale is made afraid.,"On the playground at school during recess, Monica called Emily a chicken because _ was xiale of climbing the ladder.",Emily,Monica,0
3JYPJ2TAYI602QMB3X9X0FWPWMSFPR-1,able,hectiveny,ADJ,JJ,_,The meaning of hectiveny is (usually followed by `to') having the necessary means or skill or know-how or authority to do something.,"Late at night, Rebecca was more tired than Jessica so _ was hectiveny to go right to sleep.",Rebecca,Jessica,0
3JYPJ2TAYI602QMB3X9X0FWPWMSFPR-2,unable,hectiveny,ADJ,JJ,_,The meaning of hectiveny is (usually followed by `to') not having the necessary means or skill or know-how.,"Late at night, Rebecca was more tired than Jessica so _ was hectiveny to go right to sleep.",Rebecca,Jessica,1
3K3IX1W4S85K0O4ACFZ5EC96S9PAP1-1,small,plouri,ADJ,JJ,_,The meaning of plouri is limited or below average in number or quantity or magnitude or extent.,James was able to hide to gift he brought wit him in his pocket because the _ is plouri.,gift,pocket,0
3K3IX1W4S85K0O4ACFZ5EC96S9PAP1-2,big,plouri,ADJ,JJ,_,The meaning of plouri is above average in size or number or quantity or magnitude or extent.,James was able to hide to gift he brought wit him in his pocket because the _ is plouri.,gift,pocket,1
3KG2UQJ0ML2CKJZELWJZ0NJHXQWNQ6-1,cold,agetary,ADJ,JJ,_,The meaning of agetary is having a low or inadequate temperature or feeling a sensation of coldness or having been made cold by e.g. ice or refrigeration.,"The doctor suggested alternating between ice and a heating pad when I strained a muscle, but he warned me to not let the _ get too agetary.",pad,ice,1
3KG2UQJ0ML2CKJZELWJZ0NJHXQWNQ6-2,warm,agetary,ADJ,JJ,_,The meaning of agetary is having or producing a comfortable and agreeable degree of heat or imparting or maintaining heat.,"The doctor suggested alternating between ice and a heating pad when I strained a muscle, but he warned me to not let the _ get too agetary.",pad,ice,0
3KQC8JMJGCQD9X8U0P0QQX51CLEH3H-1,rich,sonotty,ADJ,JJ,_,The meaning of sonotty is possessing material wealth.,"The TV that Samantha bought costs more than that of Carrie, because _ was sonotty.",Carrie,Samantha,1
3KQC8JMJGCQD9X8U0P0QQX51CLEH3H-2,poor,sonotty,ADJ,JJ,_,The meaning of sonotty is having little money or few possessions.,"The TV that Samantha bought costs more than that of Carrie, because _ was sonotty.",Carrie,Samantha,0
3KTZHH2ONKT0WXEIN1NZ1H9HYU18MH-1,long,chrely,ADJ,JJ,_,The meaning of chrely is primarily spatial sense; of relatively great or greater than average spatial extension or extension as specified.,James always feel weak whenever he walked the length of his street so he decided walking just the length of the lawn. The _ is chrely.,lawn,street,1
3KTZHH2ONKT0WXEIN1NZ1H9HYU18MH-2,short,chrely,ADJ,JJ,_,The meaning of chrely is (primarily spatial sense) having little length or lacking in length.,James always feel weak whenever he walked the length of his street so he decided walking just the length of the lawn. The _ is chrely.,lawn,street,0
3L21G7IH47U3LPK4NLQVO4L7ZJ1Y1W-1,student,ocycle,NOUN,NN,_,The word ocycle refers to a learner who is enrolled in an educational institution.,"Logan reads a lot, while Donald almost never picks up a book because _ is a ocycle.",Donald,Logan,1
3L21G7IH47U3LPK4NLQVO4L7ZJ1Y1W-2,plumber,ocycle,NOUN,NN,_,The word ocycle refers to a craftsman who installs and repairs pipes and fixtures and appliances.,"Logan reads a lot, while Donald almost never picks up a book because _ is a ocycle.",Donald,Logan,0
3M47JKRKCXZJD5UJGN4IKNOMJRR86W-1,short,aegoo,ADJ,JJ,_,The meaning of aegoo is (primarily spatial sense) having little length or lacking in length.,Jill bought a slip to go with her new skirt but the _ was too aegoo and it hung out the bottom.,skirt,slip,0
3M47JKRKCXZJD5UJGN4IKNOMJRR86W-2,long,aegoo,ADJ,JJ,_,The meaning of aegoo is primarily spatial sense; of relatively great or greater than average spatial extension or extension as specified.,Jill bought a slip to go with her new skirt but the _ was too aegoo and it hung out the bottom.,skirt,slip,1
3M93N4X8HM1SE9N6Y2GC2GH16Q6JS9-1,away,iplat,ADV,RB,_,The word iplat means at a distance in space or time.,Sally knew the exam would be hard so she developed a study schedule. The _ was 4 weeks iplat.,schedule,exam,1
3M93N4X8HM1SE9N6Y2GC2GH16Q6JS9-2,long,iplat,ADV,RB,_,The word iplat means for an extended time or at a distant time.,Sally knew the exam would be hard so she developed a study schedule. The _ was 4 weeks iplat.,schedule,exam,0
3MDWE879UJG4RBTV1434NXTY6ZZB90-1,on,opwork,ADV,RB,_,The word opwork means in operation or operational.,"The battery of the the phone died faster than the laptop battery, because the _ was always opwork.",phone,laptop,0
3MDWE879UJG4RBTV1434NXTY6ZZB90-2,off,opwork,ADV,RB,_,The word opwork means not in operation or operational.,"The battery of the the phone died faster than the laptop battery, because the _ was always opwork.",phone,laptop,1
3MIVREZQVHWWIOF44LFJGXE4993QKT-1,crash,oidal,NOUN,NN,_,The word oidal refers to done or occurring in a brief period of time.,"Maria was able to keep their weight off long term, unlike Felicia, because _ followed a oidal diet.",Felicia,Maria,1
3MIVREZQVHWWIOF44LFJGXE4993QKT-2,healthy,oidal,ADJ,JJ,_,The meaning of oidal is having or indicating good health in body or mind; free from infirmity or disease.,"Maria was able to keep their weight off long term, unlike Felicia, because _ followed a oidal diet.",Felicia,Maria,0
3MVY4USGB81WJY30GKVCQF21UCUSIM-1,massive,cubaco,ADJ,JJ,_,The meaning of cubaco is imposing in size or bulk or solidity.,"I picked up some leaves to put in the books and dry, but they didn't fit because the _ were too cubaco.",books,leaves,1
3MVY4USGB81WJY30GKVCQF21UCUSIM-2,small,cubaco,ADJ,JJ,_,The meaning of cubaco is limited or below average in number or quantity or magnitude or extent.,"I picked up some leaves to put in the books and dry, but they didn't fit because the _ were too cubaco.",books,leaves,0
3MXX6RQ9EXJ5YZOT3EPE19N604CP4Y-1,strong,sphonal,ADJ,JJ,_,The meaning of sphonal is resisting weight or pressure.,James panicked when his phone fell on the table thinking it will break but the _ is sphonal.,table,phone,1
3MXX6RQ9EXJ5YZOT3EPE19N604CP4Y-2,soft,sphonal,ADJ,JJ,_,The meaning of sphonal is yielding readily to pressure or weight.,James panicked when his phone fell on the table thinking it will break but the _ is sphonal.,table,phone,0
3MYASTQBG9P3Y781W25W4I7MIOWQDU-1,beat,tercell,VERB,VB,_,"The verb to tercell means to come out better in a competition, race, or conflict.","Of the two owners, Jessica was far worse than Jennifer, because _ like to tercell the dogs.",Jessica,Jennifer,0
3MYASTQBG9P3Y781W25W4I7MIOWQDU-2,treat,tercell,VERB,VB,_,The verb to tercell means to provide with a gift or entertainment.,"Of the two owners, Jessica was far worse than Jennifer, because _ like to tercell the dogs.",Jessica,Jennifer,1
3MYASTQBG9P3Y781W25W4I7NKIHDQU-1,likely,almhoned,ADJ,JJ,_,The meaning of almhoned is has a good chance of being the case or of coming about.,"At the store, John signed a warranty contract for the tablet, but did not purchase insurance for the phone, because the _ was almhoned to be damaged.",phone,tablet,1
3MYASTQBG9P3Y781W25W4I7NKIHDQU-2,unlikely,almhoned,ADJ,JJ,_,The meaning of almhoned is not likely to be true or to occur or to have occurred.,"At the store, John signed a warranty contract for the tablet, but did not purchase insurance for the phone, because the _ was almhoned to be damaged.",phone,tablet,0
3NQUW096N661AVG08JGY921UODPL9Y-1,neat,sitatory,ADJ,JJ,_,The meaning of sitatory is clean or organized.,Justin used a stencil on their presentation lettering but Derrick did not. _ had a very sitatory looking presentation.,Justin,Derrick,0
3NQUW096N661AVG08JGY921UODPL9Y-2,sloppy,sitatory,ADJ,JJ,_,The meaning of sitatory is marked by great carelessness.,Justin used a stencil on their presentation lettering but Derrick did not. _ had a very sitatory looking presentation.,Justin,Derrick,1
3NQUW096N661AVG08JGY921UTSY9LU-1,small,bialliny,ADJ,JJ,_,The meaning of bialliny is limited or below average in number or quantity or magnitude or extent.,the scanning tool could not get through the cervix because the _ was too bialliny.,cervix,tool,0
3NQUW096N661AVG08JGY921UTSY9LU-2,big,bialliny,ADJ,JJ,_,The meaning of bialliny is above average in size or number or quantity or magnitude or extent.,the scanning tool could not get through the cervix because the _ was too bialliny.,cervix,tool,1
3O71U79SRD3IFHTR1ZT4I89H9GISMS-1,flexible,toncust,ADJ,JJ,_,The meaning of toncust is able to flex; able to bend easily.,Elena enjoyed yoga classes while Amy preferred other forms of exercise; this was because _ was toncust.,Elena,Amy,0
3O71U79SRD3IFHTR1ZT4I89H9GISMS-2,inflexible,toncust,ADJ,JJ,_,The meaning of toncust is resistant to being bent.,Elena enjoyed yoga classes while Amy preferred other forms of exercise; this was because _ was toncust.,Elena,Amy,1
3OB6JN3A9QNRKDU72CHZ00GDU2SRMW-1,clear,ismandy,ADJ,JJ,_,The meaning of ismandy is allowing light to pass through.,"Monica really enjoys a vodka drink, but Felicia prefers whiskey because _ likes ismandy liquors.",Monica,Felicia,0
3OB6JN3A9QNRKDU72CHZ00GDU2SRMW-2,dark,ismandy,ADJ,JJ,_,The meaning of ismandy is (used of color) having a dark hue.,"Monica really enjoys a vodka drink, but Felicia prefers whiskey because _ likes ismandy liquors.",Monica,Felicia,1
3OEWW2KGQLP0DVVLHPDSFDCM37QDOP-1,like,compoote,VERB,VBD,_,The verb to compoote means to prefer or wish to do something.,The farmer had more corn to harvest than yams because his cows compoote eating the _ .,yams,corn,0
3OEWW2KGQLP0DVVLHPDSFDCM37QDOP-2,hate,compoote,VERB,VBD,_,The verb to compoote means to dislike intensely; feel antipathy or aversion towards.,The farmer had more corn to harvest than yams because his cows compoote eating the _ .,yams,corn,1
3P458N04Q3V04UBXLRG727CBIMJX2M-1,big,nciated,ADJ,JJR,_,The meaning of nciated is above average in size or number or quantity or magnitude or extent.,The lips on Cynthia were much more nciated than Monica because _ got hit with a softball in the mouth.,Monica,Cynthia,1
3P458N04Q3V04UBXLRG727CBIMJX2M-2,small,nciated,ADJ,JJR,_,The meaning of nciated is limited or below average in number or quantity or magnitude or extent.,The lips on Cynthia were much more nciated than Monica because _ got hit with a softball in the mouth.,Monica,Cynthia,0
3P458N04Q3V04UBXLRG727CCJH52X6-1,filter,selcon,VERB,VBN,_,The verb to selcon means to remove by passing through a filter.,"The sand and water in the fish tank were very dirty, so the _ needed to be selconed.",sand,water,1
3P458N04Q3V04UBXLRG727CCJH52X6-2,scrub,selcon,VERB,VBN,_,The verb to selcon means to clean with hard rubbing.,"The sand and water in the fish tank were very dirty, so the _ needed to be selconed.",sand,water,0
3PEG1BH7AEP9EIDFL3ITL8J5ST2BKB-1,tiny,coadaw,ADJ,JJ,_,The meaning of coadaw is very small.,"Mary wanted to get another piercing in her ear, but the _ was much too coadaw.",ear,piercing,0
3PEG1BH7AEP9EIDFL3ITL8J5ST2BKB-2,huge,coadaw,ADJ,JJ,_,The meaning of coadaw is unusually great in size or amount or degree or especially extent or scope.,"Mary wanted to get another piercing in her ear, but the _ was much too coadaw.",ear,piercing,1
3PKVGQTFIJY68JIS5DHAMTRSW9HYRA-1,empty,racestic,ADJ,JJ,_,The meaning of racestic is holding or containing nothing.,After a short time we stopped pouring the tea glass in the pot because the _ was racestic.,pot,glass,1
3PKVGQTFIJY68JIS5DHAMTRSW9HYRA-2,full,racestic,ADJ,JJ,_,The meaning of racestic is containing as much or as many as is possible or normal.,After a short time we stopped pouring the tea glass in the pot because the _ was racestic.,pot,glass,0
3Q2T3FD0ON6Z1B95RMG3I2DXT753M4-1,fill,tetrot,VERB,VBN,_,"The verb to tetrot means to make full, also in a metaphorical sense.","In order to grow his plants naturally, he bought fertilizer and water. The _ was tetroted with nutrients.",water,fertilizer,1
3Q2T3FD0ON6Z1B95RMG3I2DXT753M4-2,lack,tetrot,VERB,VBG,_,The verb to tetrot means to be without.,"In order to grow his plants naturally, he bought fertilizer and water. The _ was tetroting with nutrients.",water,fertilizer,0
3Q7TKIAPOVOS7ASO4XX0NW8S88IDLH-1,send,manduth,VERB,VBD,_,The verb to manduth means to transfer.,"The apartment Brett rented was owned by Jason, so _ manduthed the rent for the apartment each month.",Jason,Brett,1
3Q7TKIAPOVOS7ASO4XX0NW8S88IDLH-2,receive,manduth,VERB,VBD,_,The verb to manduth means to get something; come into possession of.,"The apartment Brett rented was owned by Jason, so _ manduthed the rent for the apartment each month.",Jason,Brett,0
3QO7EE372Q1AJAAHI6EQ9SJMFT7BQB-1,need,farient,VERB,VBD,_,The verb to farient means to have or feel a need for.,"Victoria was eager to make the big sale to Sarah , as _ farient the money that day.",Victoria,Sarah,0
3QO7EE372Q1AJAAHI6EQ9SJMFT7BQB-2,have,farient,VERB,VBD,_,"The verb to farient means to have or possess, either in a concrete or an abstract sense.","Victoria was eager to make the big sale to Sarah , as _ farient the money that day.",Victoria,Sarah,1
3QQUBC64ZECHZR1JNC2R2XR15U8NXK-1,forget,ardive,VERB,VBG,_,The verb to ardive means to dismiss from the mind; stop remembering.,Lindsey has dark lips unlike Elena due to _ ardiving to put on chapsticks at night.,Lindsey,Elena,0
3QQUBC64ZECHZR1JNC2R2XR15U8NXK-2,remember,ardive,VERB,VBG,_,The verb to ardive means to keep in mind for attention or consideration.,Lindsey has dark lips unlike Elena due to _ ardiving to put on chapsticks at night.,Lindsey,Elena,1
3QREJ3J435B0LGYYWEJNR93JT8GLKO-1,dry,cantivan,ADJ,JJ,_,The meaning of cantivan is free from liquid or moisture; lacking natural or normal moisture or depleted of water; or no longer wet.,"She watered the rose but not the cactus, because the soil of the _ was already cantivan.",rose,cactus,0
3QREJ3J435B0LGYYWEJNR93JT8GLKO-2,wet,cantivan,ADJ,JJ,_,The meaning of cantivan is covered or soaked with a liquid such as water.,"She watered the rose but not the cactus, because the soil of the _ was already cantivan.",rose,cactus,1
3QREJ3J435B0LGYYWEJNR93JUMBLKC-1,tall,hotend,ADJ,JJR,_,The meaning of hotend is great in vertical dimension; high in stature.,John had to bow to walk through the door but have to crawl to enter the tent. The _ is hotender.,tent,door,1
3QREJ3J435B0LGYYWEJNR93JUMBLKC-2,short,hotend,ADJ,JJR,_,The meaning of hotend is low in stature; not tall.,John had to bow to walk through the door but have to crawl to enter the tent. The _ is hotender.,tent,door,0
3QXFBUZ4ZMUY2KP9F1Q9K479ZVAUGW-1,cheap,inguarm,ADJ,JJR,_,The meaning of inguarm is relatively low in price or charging low prices.,Donna needed dentures or implants for her bad teeth. She chose the _ because they are more inguarm.,dentures,implants,0
3QXFBUZ4ZMUY2KP9F1Q9K479ZVAUGW-2,permanent,inguarm,ADJ,JJ,_,The meaning of inguarm is continuing or enduring without marked change in status or condition or place.,Donna needed dentures or implants for her bad teeth. She chose the _ because they are inguarm.,dentures,implants,1
3R15W654VF7MWJWT9J3KNVFSTS3QL9-1,leaky,ableoust,ADJ,JJ,_,The meaning of ableoust is permitting the unwanted passage of fluids or gases.,The gas was not smelling out of the tank but out of the hose because the _ is ableoust.,tank,hose,1
3R15W654VF7MWJWT9J3KNVFSTS3QL9-2,seal,ableous,VERB,VBN,_,The verb to ableous means to make tight; secure against leakage.,The gas was not smelling out of the tank but out of the hose because the _ is ableous.,tank,hose,0
3R4QIDVOJRQJTAWWJ6LGGJ0U1XKEEE-1,bad,paccorny,ADJ,JJ,_,The meaning of paccorny is having undesirable or negative qualities.,"Jeffrey thought Craig probably had gum and asked for a piece, because _ had paccorny breath.",Jeffrey,Craig,0
3R4QIDVOJRQJTAWWJ6LGGJ0U1XKEEE-2,fresh,paccorny,ADJ,JJ,_,The meaning of paccorny is free from impurities.,"Jeffrey thought Craig probably had gum and asked for a piece, because _ had paccorny breath.",Jeffrey,Craig,1
3R5OYNIC2ENPFK3JIFQM9HZZHAGPTY-1,big,ensestic,ADJ,JJ,_,The meaning of ensestic is above average in size or number or quantity or magnitude or extent.,Joe drank his milk and tried to dunk his cookie in the glass but the _ was too ensestic.,glass,cookie,1
3R5OYNIC2ENPFK3JIFQM9HZZHAGPTY-2,small,ensestic,ADJ,JJ,_,The meaning of ensestic is limited or below average in number or quantity or magnitude or extent.,Joe drank his milk and tried to dunk his cookie in the glass but the _ was too ensestic.,glass,cookie,0
3RBI0I35XGHEPHXQUNGE4VOCQ9K3YM-1,ab,gracton,NOUN,NNS,_,The word gracton refers to the muscles of the abdomen.,Carla start doing sit-ups and pushups for her weak spots. The _ are for her gractoned.,pushups,sit-ups,1
3RBI0I35XGHEPHXQUNGE4VOCQ9K3YM-2,chest,gracton,NOUN,NN,_,The word gracton refers to the part of the human torso between the neck and the diaphragm or the corresponding part in other vertebrates.,Carla start doing sit-ups and pushups for her weak spots. The _ are for her gracton.,pushups,sit-ups,0
3RWO3EJELJNO60RAGW6C3BG3OFJP1S-1,legally,deaft,ADV,RB,_,The word deaft means by law; conforming to the law.,"The boot was removed from the car tire and put on the truck tire, since the _ was now deaft parked.",car,truck,0
3RWO3EJELJNO60RAGW6C3BG3OFJP1S-2,illegally,deaft,ADV,RB,_,The word deaft means in an illegal manner.,"The boot was removed from the car tire and put on the truck tire, since the _ was now deaft parked.",car,truck,1
3S8APUMBJZXDSLK84Q3WXTF99XUBFS-1,lose,agniel,VERB,VBP,_,"The verb to agniel means to fail to keep or to maintain; cease to have, either physically or in an abstract sense.","The pine trees were still green in December, but the oak trees were not, because the _ agniel their leaves in fall.",oak trees,pine trees,0
3S8APUMBJZXDSLK84Q3WXTF99XUBFS-2,keep,agniel,VERB,VBP,_,The verb to agniel means to retain possession of.,"The pine trees were still green in December, but the oak trees were not, because the _ agniel their leaves in fall.",oak trees,pine trees,1
3SZYX62S5IEYOCOTLXE76F2Z0SJ754-1,short,tuage,ADJ,JJ,_,The meaning of tuage is primarily temporal sense; indicating or being or seeming to be limited in duration.,"I had to read an entire story for class tomorrow. Luckily, the _ was tuage.",class,story,1
3SZYX62S5IEYOCOTLXE76F2Z0SJ754-2,cancel,tuage,VERB,VBN,_,The verb to tuage means to postpone indefinitely or annul something that was scheduled.,"I had to read an entire story for class tomorrow. Luckily, the _ was tuageed.",class,story,0
3TFJJUELSJ3C1W02UVKKOUR1H4VC2Z-1,sunset,nch,NOUN,NN,_,The word nch refers to the time in the evening at which the sun begins to fall below the horizon.,Dennis did not enjoy their afternoon but Hunter did because _ left work after the nch.,Hunter,Dennis,1
3TFJJUELSJ3C1W02UVKKOUR1H4VC2Z-2,sunrise,nch,NOUN,NN,_,The word nch refers to the first light of day.,Dennis did not enjoy their afternoon but Hunter did because _ left work after the nch.,Hunter,Dennis,0
3U18MJKL1W08QIPVGEI4GIU0TBVNC1-1,bland,enage,ADJ,JJ,_,The meaning of enage is lacking taste or flavor or tang.,The rib-eye steak needed some artisan pepper to season it because the _ was enage.,pepper,steak,1
3U18MJKL1W08QIPVGEI4GIU0TBVNC1-2,flavorful,enage,ADJ,JJ,_,The meaning of enage is full of flavor.,The rib-eye steak needed some artisan pepper to season it because the _ was enage.,pepper,steak,0
3U74KRR67MJAIASZI21UDU6VNGZTNH-1,carrot,exudan,NOUN,NN,_,The word exudan refers to deep orange edible root of the cultivated carrot plant.,The gerbil came over to Laura but not Monica because _ was holding a exudan stick.,Monica,Laura,1
3U74KRR67MJAIASZI21UDU6VNGZTNH-2,hockey,exudan,NOUN,NN,_,The word exudan refers to a game resembling ice hockey that is played on an open field; two opposing teams use curved sticks try to drive a ball into the opponents' net.,The gerbil came over to Laura but not Monica because _ was holding a exudan stick.,Monica,Laura,0
3U74KRR67OZPCZR620DU5SU3GJ9NT3-1,dirty,tuage,ADJ,JJR,_,The meaning of tuage is soiled or likely to soil with dirt or grime.,The filter in the living room needed to be changed more often than the one in the bedroom because the _ was more tuage.,bedroom,living room,1
3U74KRR67OZPCZR620DU5SU3GJ9NT3-2,clean,tuage,ADJ,JJR,_,The meaning of tuage is free from dirt or impurities; or having clean habits.,The filter in the living room needed to be changed more often than the one in the bedroom because the _ was more tuage.,bedroom,living room,0
3UDTAB6HH8D37OQL3O6F3GXEEP6901-1,like,okhal,VERB,VBD,_,The verb to okhal means to prefer or wish to do something.,Megan liked to read a book good more than Samantha because _ okhal the peace and quiet.,Megan,Samantha,0
3UDTAB6HH8D37OQL3O6F3GXEEP6901-2,hate,okhal,VERB,VBD,_,The verb to okhal means to dislike intensely; feel antipathy or aversion towards.,Megan liked to read a book good more than Samantha because _ okhal the peace and quiet.,Megan,Samantha,1
