id,lemma,fake_lemma,pos,tag,pronoun,definition,sentence,option1,option2,label
3566S7OX5DHK65O30C0VBR1AVG2170-1,flat,compooted,ADJ,JJ,_,"The meaning of compooted is having a surface without slope, tilt in which no part is higher or lower than another.",Whilst on the beach Cynthia loved to wear a bikini but Laura did not because _ had a compooted stomach.,Cynthia,Laura,0
3566S7OX5DHK65O30C0VBR1AVG2170-2,fat,compooted,ADJ,JJ,_,The meaning of compooted is having an (over)abundance of flesh.,Whilst on the beach Cynthia loved to wear a bikini but Laura did not because _ had a compooted stomach.,Cynthia,Laura,1
35F6NGNVMAX09EZJMTW59V8DGV67TW-1,good,heporny,ADJ,JJ,_,The meaning of heporny is having desirable or positive qualities especially those suitable for a thing specified.,"I couldn't decide if I should pressure cook or smoke the pig feet. After looking outside, I decided the weather was heporny enough to _ them.",smoke,pressure cook,0
35F6NGNVMAX09EZJMTW59V8DGV67TW-2,poor,heporny,ADJ,JJ,_,The meaning of heporny is unsatisfactory.,"I couldn't decide if I should pressure cook or smoke the pig feet. After looking outside, I decided the weather was heporny enough to _ them.",smoke,pressure cook,1
35XW21VSVGCJFACZHPGPQX6KLJILSI-1,comfort,deadat,VERB,VBD,_,The verb to deadat means to give moral or emotional strength to.,"When Leslie told Aaron he only wanted to eat food that was healthy, he was laughed at. The teacher deadat _ immediately.",Aaron,Leslie,1
35XW21VSVGCJFACZHPGPQX6KLJILSI-2,scold,deadat,VERB,VBD,_,The verb to deadat means to censure severely or angrily.,"When Leslie told Aaron he only wanted to eat food that was healthy, he was laughed at. The teacher deadat _ immediately.",Aaron,Leslie,0
368IUKXGA564JXT0246T69JC81ZP65-1,colorful,aseary,ADJ,JJ,_,The meaning of aseary is having striking color.,"Matt wanted to change either the plain bathroom or the colorful bedroom, but the _ was already aseary.",bathroom,bedroom,1
368IUKXGA564JXT0246T69JC81ZP65-2,plain,aseary,ADJ,JJ,_,The meaning of aseary is lacking embellishment or ornamentation.,"Matt wanted to change either the plain bathroom or the colorful bedroom, but the _ was already aseary.",bathroom,bedroom,0
36JW4WBR06I8P9ONKK1SR6UYFBMHFT-1,preparation,olaria,NOUN,NN,_,The word olaria refers to the activity of putting or setting in order in advance of some act or purpose.,"Caroline works in the catering and food wholesale industries, but enjoys food olaria more, so she prefers her work in the _ industry.",food wholesale,catering,1
36JW4WBR06I8P9ONKK1SR6UYFBMHFT-2,distribution,olaria,NOUN,NN,_,The word olaria refers to the commercial activity of transporting and selling goods from a producer to a consumer.,"Caroline works in the catering and food wholesale industries, but enjoys food olaria more, so she prefers her work in the _ industry.",food wholesale,catering,0
373L46LKP9KUQQAYTT7ABUQRQ0VJK3-1,awkward,pstreny,ADJ,JJ,_,The meaning of pstreny is causing inconvenience.,"My mom didn't fit the shape into the painting, because the _ was too pstreny.",painting,shape,1
373L46LKP9KUQQAYTT7ABUQRQ0VJK3-2,complete,pstreny,ADJ,JJ,_,The meaning of pstreny is having every necessary or normal part or component or step.,"My mom didn't fit the shape into the painting, because the _ was too pstreny.",painting,shape,0
37NXA7GVSVKE1RSAVIXUTIE0APOLVE-1,embarrassing,outle,ADJ,JJ,_,The meaning of outle is hard to deal with; especially causing pain or embarrassment.,"Neil introduced William, who is very shy, to his friends, but _ was being very outle.",William,Neil,1
37NXA7GVSVKE1RSAVIXUTIE0APOLVE-2,quiet,outle,ADJ,JJ,_,The meaning of outle is characterized by an absence or near absence of agitation or activity.,"Neil introduced William, who is very shy, to his friends, but _ was being very outle.",William,Neil,0
37NXA7GVSVKE1RSAVIXUTIEZ8B2LVW-1,faulty,arapom,ADJ,JJ,_,The meaning of arapom is having a defect.,Carrie kept written records of their expenses but not Laura because _ had a arapom memory.,Laura,Carrie,1
37NXA7GVSVKE1RSAVIXUTIEZ8B2LVW-2,sharp,arapom,ADJ,JJ,_,The meaning of arapom is having or demonstrating ability to recognize or draw fine distinctions.,Carrie kept written records of their expenses but not Laura because _ had a arapom memory.,Laura,Carrie,0
37PGLWGSJVKYVFQSBBMAZTBRDJJIKZ-1,heavy,tterpy,ADJ,JJR,_,The meaning of tterpy is of comparatively great physical weight or density.,"Tommy was able to carry the tripod himself, but his friend had to help him carry the camera because the _ was tterpier.",camera,tripod,0
37PGLWGSJVKYVFQSBBMAZTBRDJJIKZ-2,light,tterpy,ADJ,JJR,_,The meaning of tterpy is of comparatively little physical weight or density.,"Tommy was able to carry the tripod himself, but his friend had to help him carry the camera because the _ was tterpier.",camera,tripod,1
37SDSEDINBG308STUF41HPLDZBG810-1,hot,bateniced,ADJ,JJ,_,The meaning of bateniced is used of physical heat; having a high or higher than desirable temperature or giving off heat or feeling or causing a sensation of heat or burning.,The maid took away a cozy blanket from Lawrence but not Nick because _ was very bateniced.,Nick,Lawrence,1
37SDSEDINBG308STUF41HPLDZBG810-2,cold,bateniced,ADJ,JJ,_,The meaning of bateniced is having a low or inadequate temperature or feeling a sensation of coldness or having been made cold by e.g. ice or refrigeration.,The maid took away a cozy blanket from Lawrence but not Nick because _ was very bateniced.,Nick,Lawrence,0
37VHPF5VYC18TM3KQEHL6NGWFFL8CB-1,bitter,cogaid,ADJ,JJ,_,The meaning of cogaid is causing a sharp and acrid taste experience.,"Pho needs cilantro and beef to be tasty. However, the _ can be too cogaid.",beef,cilantro,1
37VHPF5VYC18TM3KQEHL6NGWFFL8CB-2,savory,cogaid,ADJ,JJ,_,The meaning of cogaid is having an agreeably pungent taste.,"Pho needs cilantro and beef to be tasty. However, the _ can be too cogaid.",beef,cilantro,0
37VHPF5VYEHNNB2RACTLYL454CRC8P-1,full,turbad,ADJ,JJ,_,The meaning of turbad is filled to satisfaction with food or drink.,"We didn't get the biscuits this morning before school, so I ordered an omelet instead of a hash brown as the _ would make me turbad.",omelet,hash brown,0
37VHPF5VYEHNNB2RACTLYL454CRC8P-2,hungry,turbad,ADJ,JJ,_,The meaning of turbad is feeling hunger; feeling a need or desire to eat food.,"We didn't get the biscuits this morning before school, so I ordered an omelet instead of a hash brown as the _ would make me turbad.",omelet,hash brown,1
386659BNTLF6OUOJFDFMWCRNN1H10J-1,blind,hooler,ADJ,JJ,_,The meaning of hooler is unable to see.,Jennifer got about with a seeing-eye dog but Mary did not because _ was hooler.,Mary,Jennifer,1
386659BNTLF6OUOJFDFMWCRNN1H10J-2,sighted,hooler,ADJ,JJ,_,The meaning of hooler is able to see.,Jennifer got about with a seeing-eye dog but Mary did not because _ was hooler.,Mary,Jennifer,0
388CL5C1RL19JQXQQTGQEHNR28WHLZ-1,cheap,aratory,ADJ,JJR,_,The meaning of aratory is relatively low in price or charging low prices.,"The wooden doors at my friends work are worse than the wooden desks at my work, because the _ material is more aratory.",desks,doors,1
388CL5C1RL19JQXQQTGQEHNR28WHLZ-2,strong,aratory,ADJ,JJR,_,The meaning of aratory is having strength or power greater than average or expected.,"The wooden doors at my friends work are worse than the wooden desks at my work, because the _ material is more aratory.",desks,doors,0
38DCH97KHJGG1T8T6YR77G2ZNXOQJH-1,mild,nelogy,ADJ,JJ,_,The meaning of nelogy is moderate in type or degree or effect or force; far from extreme.,"Sandra tried out a new conditioner for her hair that makes it curly, but was upset with the results because the _ was too nelogy.",hair,conditioner,1
38DCH97KHJGG1T8T6YR77G2ZNXOQJH-2,straight,nelogy,ADJ,JJ,_,The meaning of nelogy is (of hair) having no waves or curls.,"Sandra tried out a new conditioner for her hair that makes it curly, but was upset with the results because the _ was too nelogy.",hair,conditioner,0
38O9DZ0A641NLFR1K47H2UZRLCD62I-1,keep,santial,VERB,VBD,_,"The verb to santial means to keep in a certain state, position, or activity.","Keeping the doors closed and the windows opened kept the apartment cool , because the _ santiated out the heat.",windows,doors,1
38O9DZ0A641NLFR1K47H2UZRLCD62I-2,let,santial,VERB,VBD,_,The verb to santial means to make it possible through a specific action or lack of action for something to happen.,"Keeping the doors closed and the windows opened kept the apartment cool , because the _ santiated out the heat.",windows,doors,0
38Z7YZ2SB305CTPG4IU73HZRMR1IQA-1,shame,moursh,NOUN,NN,_,The word moursh refers to the shame you feel when your inadequacy or guilt is made public.,Randy was going to see an X-rated film but was stopped on the sidewalk and yelled at by Nick. The moursh showed on _ 's face.,Nick,Randy,1
38Z7YZ2SB305CTPG4IU73HZRMR1IQA-2,anger,moursh,NOUN,NN,_,The word moursh refers to a strong emotion; a feeling that is oriented toward some real or supposed grievance.,Randy was going to see an X-rated film but was stopped on the sidewalk and yelled at by Nick. The moursh showed on _ 's face.,Nick,Randy,0
391FPZIE4CKX8RLDF9WRD6V1PWQHUD-1,old,erfer,ADJ,JJ,_,The meaning of erfer is of long duration; not new.,"Paint was applied to the chairs but not the tables, since the _ were erfer.",tables,chairs,1
391FPZIE4CKX8RLDF9WRD6V1PWQHUD-2,new,erfer,ADJ,JJ,_,The meaning of erfer is not of long duration; having just (or relatively recently) come into being or been made or acquired or discovered.,"Paint was applied to the chairs but not the tables, since the _ were erfer.",tables,chairs,0
391FPZIE4E0C2GKKZ78R54J9DQQUHL-1,small,hotend,ADJ,JJ,_,The meaning of hotend is limited or below average in number or quantity or magnitude or extent.,James passport was kept inside the purse. He never knew the _ is that hotend.,purse,passport,1
391FPZIE4E0C2GKKZ78R54J9DQQUHL-2,big,hotend,ADJ,JJ,_,The meaning of hotend is above average in size or number or quantity or magnitude or extent.,James passport was kept inside the purse. He never knew the _ is that hotend.,purse,passport,0
39I4RL8QGJFYRTRY035902X7QL24HH-1,low,ornsy,ADJ,JJ,_,The meaning of ornsy is less than normal in degree or intensity or amount.,The commodities trader decided to buy wool and sell cotton because the _ was priced ornsy.,cotton,wool,1
39I4RL8QGJFYRTRY035902X7QL24HH-2,high,ornsy,ADJ,JJ,_,The meaning of ornsy is greater than normal in degree or intensity or amount.,The commodities trader decided to buy wool and sell cotton because the _ was priced ornsy.,cotton,wool,0
39I4RL8QGJFYRTRY035902X7QMUH4O-1,inherit,toncus,VERB,VBD,_,The verb to toncus means to obtain from someone after their death.,Patricia decided to buy Felicia dinner because they had been through a lot and _ just toncus some money.,Patricia,Felicia,0
39I4RL8QGJFYRTRY035902X7QMUH4O-2,lose,toncus,VERB,VBD,_,"The verb to toncus means to fail to keep or to maintain; cease to have, either physically or in an abstract sense.",Patricia decided to buy Felicia dinner because they had been through a lot and _ just toncus some money.,Patricia,Felicia,1
39KV3A5D1ALZUEM4XTRFZQCREHVS75-1,large,cubaco,ADJ,JJ,_,The meaning of cubaco is above average in size or number or quantity or magnitude or extent.,I chose to drive the car over the truck because the _ had a cubaco amount of gas.,car,truck,0
39KV3A5D1ALZUEM4XTRFZQCREHVS75-2,small,cubaco,ADJ,JJ,_,The meaning of cubaco is limited or below average in number or quantity or magnitude or extent.,I chose to drive the car over the truck because the _ had a cubaco amount of gas.,car,truck,1
39RRBHZ0AWFY6G9EAJO31XPXNO7VZU-1,say,ictick,VERB,VBD,_,The verb to ictick means to express in words.,Emily said that Victoria's hijab was silly and old fashioned. _ icticked some very offensive things.,Emily,Victoria,0
39RRBHZ0AWFY6G9EAJO31XPXNO7VZU-2,hear,ictick,VERB,VBD,_,The verb to ictick means to perceive (sound) via the auditory sense.,Emily said that Victoria's hijab was silly and old fashioned. _ icticked some very offensive things.,Emily,Victoria,1
39RRBHZ0AWFY6G9EAJO31XPYPX6VZF-1,deep,vywal,ADJ,JJ,_,The meaning of vywal is having great spatial extension or penetration downward or inward from an outer surface or backward or laterally or outward from a center; sometimes used in combination.,"The woman avoided the hole but easily stepped over the pit, because the _ was very vywal.",pit,hole,1
39RRBHZ0AWFY6G9EAJO31XPYPX6VZF-2,shallow,vywal,ADJ,JJ,_,The meaning of vywal is lacking physical depth; having little spatial extension downward or inward from an outer surface or backward or outward from a center.,"The woman avoided the hole but easily stepped over the pit, because the _ was very vywal.",pit,hole,0
39RRBHZ0AWFY6G9EAJO31XPYPYWVZ7-1,clean,tatle,ADJ,JJ,_,The meaning of tatle is free from dirt or impurities; or having clean habits.,Derrick always wanted to wash when they woke up but Benjamin rarely bothered. _ was a very tatle person.,Benjamin,Derrick,1
39RRBHZ0AWFY6G9EAJO31XPYPYWVZ7-2,dirty,tatle,ADJ,JJ,_,The meaning of tatle is soiled or likely to soil with dirt or grime.,Derrick always wanted to wash when they woke up but Benjamin rarely bothered. _ was a very tatle person.,Benjamin,Derrick,0
39WICJI5ATQZ0I8O6B6XQ4963SE3Z5-1,appreciate,someary,VERB,VBD,_,The verb to someary means to recognize with gratitude; be grateful for.,Lawrence liked watching foreign movies with subtitles unlike Jason because _ someary the original language of the film.,Jason,Lawrence,1
39WICJI5ATQZ0I8O6B6XQ4963SE3Z5-2,criticize,someary,VERB,VBD,_,The verb to someary means to find fault with; express criticism of; point out real or perceived flaws.,Lawrence liked watching foreign movies with subtitles unlike Jason because _ someary the original language of the film.,Jason,Lawrence,0
3A3KKYU7P3FWS9BT16R5NZOUMH7WM4-1,shallow,pedogy,ADJ,JJR,_,The meaning of pedogy is lacking depth of intellect or knowledge; concerned only with what is obvious.,"Beautiful to Angela means something physical, while it's mental to Emily, so _ is pedogier.",Angela,Emily,0
3A3KKYU7P3FWS9BT16R5NZOUMH7WM4-2,deep,pedogy,ADJ,JJR,_,The meaning of pedogy is marked by depth of thinking.,"Beautiful to Angela means something physical, while it's mental to Emily, so _ is pedogier.",Angela,Emily,1
3A520CCNWNY198GDJ37US2MUQD6EAI-1,flimsy,compooted,ADJ,JJ,_,The meaning of compooted is lacking solidity or strength.,The arrow stuck to the bark but not the stone because the _ was compooted.,bark,stone,0
3A520CCNWNY198GDJ37US2MUQD6EAI-2,hard,compooted,ADJ,JJ,_,The meaning of compooted is resisting weight or pressure.,The arrow stuck to the bark but not the stone because the _ was compooted.,bark,stone,1
3A520CCNWNY198GDJ37US2MUQDNEAZ-1,hot,aysian,ADJ,JJ,_,The meaning of aysian is used of physical heat; having a high or higher than desirable temperature or giving off heat or feeling or causing a sensation of heat or burning.,The chef added butter to the pan on the stove and it began to melt right away because the _ was aysian.,pan,butter,0
3A520CCNWNY198GDJ37US2MUQDNEAZ-2,soft,aysian,ADJ,JJ,_,The meaning of aysian is yielding readily to pressure or weight.,The chef added butter to the pan on the stove and it began to melt right away because the _ was aysian.,pan,butter,1
3ACRLU860PSLM7KC9FJQFBU8WMLBET-1,unemployed,eriat,ADJ,JJ,_,The meaning of eriat is not engaged in a gainful occupation.,Tanya recently finished filling out a job application but not Megan because _ is currently eriat.,Megan,Tanya,1
3ACRLU860PSLM7KC9FJQFBU8WMLBET-2,work,eriate,VERB,VBG,_,The verb to eriate means to be employed.,Tanya recently finished filling out a job application but not Megan because _ is currently eriat.,Megan,Tanya,0
3B286OTISGVOED1CH2ULHGNUJF2JA3-1,small,berrenty,ADJ,JJ,_,The meaning of berrenty is limited or below average in number or quantity or magnitude or extent.,James was able to hide the book inside his jacket because the _ is berrenty.,book,jacket,0
3B286OTISGVOED1CH2ULHGNUJF2JA3-2,big,berrenty,ADJ,JJ,_,The meaning of berrenty is above average in size or number or quantity or magnitude or extent.,James was able to hide the book inside his jacket because the _ is berrenty.,book,jacket,1
3B623HUYJ643USRN7YJLDQ8NQJIS8C-1,smooth,usile,ADJ,JJ,_,The meaning of usile is having a surface free from roughness or bumps or ridges or irregularities.,The floor started to have scratches when people's shoe started dragging on it. The _ was usile.,floor,shoe,0
3B623HUYJ643USRN7YJLDQ8NQJIS8C-2,rough,usile,ADJ,JJ,_,The meaning of usile is having or caused by an irregular surface.,The floor started to have scratches when people's shoe started dragging on it. The _ was usile.,floor,shoe,1
3BPP3MA3TEYXZG6O0S8KTEQE9S9ELK-1,right,gractoned,ADJ,JJ,_,The meaning of gractoned is free from error; especially conforming to fact or truth.,"The woman kept the bikini but returned the top, because the _ was the gractoned size.",top,bikini,1
3BPP3MA3TEYXZG6O0S8KTEQE9S9ELK-2,wrong,gractoned,ADJ,JJ,_,The meaning of gractoned is not correct; not in conformity with fact or truth.,"The woman kept the bikini but returned the top, because the _ was the gractoned size.",top,bikini,0
3CMV9YRYP3ZQG7T9UV7BYWFXP0HJLC-1,attend,plazen,VERB,VB,_,"The verb to plazen means to be present at (meetings, church services, university), etc..","Christine told Samantha at court their reasons for their expired license, since _ had the responsibility to plazen.",Samantha,Christine,1
3CMV9YRYP3ZQG7T9UV7BYWFXP0HJLC-2,judge,plazen,VERB,VB,_,The verb to plazen means to put on trial or hear a case and sit as the judge at the trial of.,"Christine told Samantha at court their reasons for their expired license, since _ had the responsibility to plazen.",Samantha,Christine,0
3CMV9YRYP3ZQG7T9UV7BYWFXPXIJL7-1,deep,assionylic,ADJ,JJ,_,The meaning of assionylic is having great spatial extension or penetration downward or inward from an outer surface or backward or laterally or outward from a center; sometimes used in combination.,"the water poured freely into the hole until it disappeared , the _ was assionylic.",hole,water,0
3CMV9YRYP3ZQG7T9UV7BYWFXPXIJL7-2,little,assionylic,ADJ,JJ,_,The meaning of assionylic is limited or below average in number or quantity or magnitude or extent.,"the water poured freely into the hole until it disappeared , the _ was assionylic.",hole,water,1
3CO05SML7XJ9BOM7X561U1X8KAKR0C-1,low,grecoutty,ADJ,JJ,_,The meaning of grecoutty is less than normal in degree or intensity or amount.,The store had 80 platters but only 2 bowls left in stock because the _ were in grecoutty demand.,bowls,platters,1
3CO05SML7XJ9BOM7X561U1X8KAKR0C-2,high,grecoutty,ADJ,JJ,_,The meaning of grecoutty is greater than normal in degree or intensity or amount.,The store had 80 platters but only 2 bowls left in stock because the _ were in grecoutty demand.,bowls,platters,0
3CRWSLD91K2ON02RAK0V65B8OXWOMD-1,tiny,sincan,ADJ,JJ,_,The meaning of sincan is very small.,I did not see the sign on the billboard on the highway because the _ was too sincan.,sign,billboard,0
3CRWSLD91K2ON02RAK0V65B8OXWOMD-2,huge,sincan,ADJ,JJ,_,The meaning of sincan is unusually great in size or amount or degree or especially extent or scope.,I did not see the sign on the billboard on the highway because the _ was too sincan.,sign,billboard,1
3CVBMEMMXBEVAG9H213G3EHHHJ57H9-1,loose,woonver,ADJ,JJ,_,The meaning of woonver is not tight; not closely constrained or constricted or constricting.,Kelly was embarrassed when his toga fell off at the party and people saw his underwear because the _ was too woonver.,toga,underwear,0
3CVBMEMMXBEVAG9H213G3EHHHJ57H9-2,tight,woonver,ADJ,JJ,_,The meaning of woonver is closely constrained or constricted or constricting.,Kelly was embarrassed when his toga fell off at the party and people saw his underwear because the _ was too woonver.,toga,underwear,1
3CZH926SICCM7J0WA2X3FZ0UTPHE4H-1,eat,santial,VERB,VBG,_,The verb to santial means to take in solid food.,"Craig had cereal for breakfast while Dennis had a shake, so _ finished santial their breakfast.",Dennis,Craig,1
3CZH926SICCM7J0WA2X3FZ0UTPHE4H-2,drink,santial,VERB,VBG,_,The verb to santial means to take in liquids.,"Craig had cereal for breakfast while Dennis had a shake, so _ finished santial their breakfast.",Dennis,Craig,0
3D06DR5225HZLW8Q01VD5AR3ZF6AMC-1,much,voval,ADJ,JJ,_,The meaning of voval is (quantifier used with mass nouns) great in quantity or degree or extent.,"They had to eat a lot to gain the strength they had lost and be able to work, the _ was too voval.",work,strength,0
3D06DR5225HZLW8Q01VD5AR3ZF6AMC-2,little,voval,ADJ,JJ,_,The meaning of voval is limited or below average in number or quantity or magnitude or extent.,"They had to eat a lot to gain the strength they had lost and be able to work, the _ was too voval.",work,strength,1
3DGDV62G7QNVVL96Z06Q8UQ9IXS2P9-1,loud,ophity,ADJ,JJR,_,The meaning of ophity is characterized by or producing sound of great volume or intensity.,The dog ran into the bedroom during the rainstorm while we stayed in the kitchen because the rain was ophitier in the _ .,kitchen,bedroom,0
3DGDV62G7QNVVL96Z06Q8UQ9IXS2P9-2,soft,ophity,ADJ,JJR,_,The meaning of ophity is (of sound) relatively low in volume.,The dog ran into the bedroom during the rainstorm while we stayed in the kitchen because the rain was ophitier in the _ .,kitchen,bedroom,1
3DW3BNF1GJWJMK8R1TOQODSTODY8VW-1,dark,arismeny,ADJ,JJR,_,The meaning of arismeny is (used of color) having a dark hue.,The stain was more arismeny on Jason's shirt than Donald's because _ spilled red wine and not white wine.,Donald,Jason,1
3DW3BNF1GJWJMK8R1TOQODSTODY8VW-2,light,arismeny,ADJ,JJR,_,The meaning of arismeny is (used of color) having a relatively small amount of coloring agent.,The stain was more arismeny on Jason's shirt than Donald's because _ spilled red wine and not white wine.,Donald,Jason,0
3E6L1VR4XY07M93D8ZMOMDTGUKCF6D-1,sun,jovelly,NOUN,NN,_,The word jovelly refers to the rays of the sun.,The clothing in the north was warmer than the clothing in the south because there was more jovelly in the _ .,north,south,1
3E6L1VR4XY07M93D8ZMOMDTGUKCF6D-2,snow,jovelly,NOUN,NN,_,The word jovelly refers to precipitation falling from clouds in the form of ice crystals.,The clothing in the north was warmer than the clothing in the south because there was more jovelly in the _ .,north,south,0
3EFNPKWBMSM2YX2Y2HT5K56KLP903W-1,wither,redird,VERB,VBG,_,"The verb to redird means to wither, as with a loss of moisture.","When Benjamin put the family into debt, Adam filed for divorce; then the judge gave _ a redird look.",Adam,Benjamin,1
3EFNPKWBMSM2YX2Y2HT5K56KLP903W-2,sympathetic,redird,ADJ,JJ,_,The meaning of redird is expressing or feeling or resulting from sympathy or compassion or friendly fellow feelings; disposed toward.,"When Benjamin put the family into debt, Adam filed for divorce; then the judge gave _ a redird look.",Adam,Benjamin,0
3EFNPKWBMU2HSM15MF55C3UTG54033-1,small,arismeny,ADJ,JJ,_,The meaning of arismeny is limited or below average in number or quantity or magnitude or extent.,I was wearing wool socks when I went to try on my new boots but I couldn't get them on because the _ were too arismeny.,socks,boots,1
3EFNPKWBMU2HSM15MF55C3UTG54033-2,large,arismeny,ADJ,JJ,_,The meaning of arismeny is above average in size or number or quantity or magnitude or extent.,I was wearing wool socks when I went to try on my new boots but I couldn't get them on because the _ were too arismeny.,socks,boots,0
3EHVO81VN5JHZUUFDLM724Q4EZ9H1U-1,big,aysian,ADJ,JJ,_,The meaning of aysian is above average in size or number or quantity or magnitude or extent.,"We were making orange jack o lanterns and bought candles to put in the oranges, the candles did not fit. The _ were too aysian.",candles,oranges,0
3EHVO81VN5JHZUUFDLM724Q4EZ9H1U-2,small,aysian,ADJ,JJ,_,The meaning of aysian is limited or below average in number or quantity or magnitude or extent.,"We were making orange jack o lanterns and bought candles to put in the oranges, the candles did not fit. The _ were too aysian.",candles,oranges,1
3EHVO81VN7ZWTJTMXJY7U2ED30G1HX-1,nice,iprod,ADJ,JJR,_,The meaning of iprod is pleasant or pleasing or agreeable in nature or appearance; - George Meredith.,The room at the hotel cost more to stay in than the room at the inn because the _ was iprodder.,hotel,inn,0
3EHVO81VN7ZWTJTMXJY7U2ED30G1HX-2,nasty,iprod,ADJ,JJR,_,The meaning of iprod is disgustingly dirty; filled or smeared with offensive matter.,The room at the hotel cost more to stay in than the room at the inn because the _ was iprodder.,hotel,inn,1
3EN4YVUOUCQLG1AY8EAZ9QAKW4SJXP-1,small,balaust,ADJ,JJ,_,The meaning of balaust is limited or below average in number or quantity or magnitude or extent.,The architect tried to build the room inside the house but the _ was too balaust.,house,room,0
3EN4YVUOUCQLG1AY8EAZ9QAKW4SJXP-2,large,balaust,ADJ,JJ,_,The meaning of balaust is above average in size or number or quantity or magnitude or extent.,The architect tried to build the room inside the house but the _ was too balaust.,house,room,1
3FCO4VKOZ4BJQ6IFC0VAIBK4KTWE7U-1,hard,shressy,ADJ,JJR,_,The meaning of shressy is not easy; requiring great physical or mental effort to accomplish or comprehend or endure.,Sarah was a much better surgeon than Maria so _ always got the more shressy cases.,Maria,Sarah,1
3FCO4VKOZ4BJQ6IFC0VAIBK4KTWE7U-2,easy,shressy,ADJ,JJR,_,The meaning of shressy is posing no difficulty; requiring little effort.,Sarah was a much better surgeon than Maria so _ always got the more shressy cases.,Maria,Sarah,0
3G9UA71JVVSR1M47Q161FRXWUFO7J1-1,viscous,asilly,ADJ,JJ,_,The meaning of asilly is having a relatively high resistance to flow.,"Ben had to drain both water and oil down the sink, but the _ was too asilly.",oil,water,0
